username,date,retweets,favorites,text
philosophyofmet,2018-05-31 22:37,4,58,"“What’s that FUD you’re spreading about XRP?” # xrpthestandard # xrpcommunity # Ripple pic.twitter.com/P11zSWYf1j"
LeoHadjiloizou,2018-05-31 21:57,15,31,"Ana Botín, Santander Group’s executive chairman said that now 50% of the bank’s annual international transfers are carried by the Ripple-powered blockchain. # XRP https://ripple.com/insights/live-transaction-santanders-onepay-fx/ …"
CryptoCoinsNews,2018-05-31 14:51,67,137,"Ripple CEO Garlinghouse: Bitcoin Price Won’t Correlate With XRP Price Forever https://www.ccn.com/ripple-ceo-garlinghouse-bitcoin-price-wont-correlate-with-xrp-price-forever/ …"
XRPTrump,2018-05-31 13:45,14,40,"Let's do a poll so you can that even your readers know the difference between XRP and Ripple. You are confusing the software solution that Ripple wants to use for their cross-border use case with the digital asset they wants to use for liquidity/settlement."
XRP_GERMANY,2018-05-31 13:40,22,132,"I love my little Ripple Rocket! (homemade single-item) # XRP # XRPcommunity # xrparmy # ripple # RippleRocket @ Ripple @ bgarlinghouse @ JoelKatz @ RipplePandaXRP @ DanPallatina @ XRPMOON @ BankXRP @ XRPTrump @ XRPMichaelBpic.twitter.com/n1s4ejOpkq"
ikarosm,2018-05-31 13:28,89,173,"Ripple and XRP for the Corporate Treasurer https://medium.com/@ikarosm/ripple-and-xrp-for-the-corporate-treasurer-6165da8b1475 … # Ripple # XRP @ JoelKatz @ diliprao # treasury # risk # payments # corporatetreasury"
BankXRP,2018-05-31 13:21,125,358,"Ripple’s CEO says XRP will break free of Bitcoin’s [BTC] price https://ambcrypto.com/ripple-ceo-xrp-break-free-bitcoin-btc-price/ …"
Capitalnvest,2018-05-31 13:18,106,345,"$ XRP 今月29日の時点でRipple社はクウェート最大の銀行との提携を発表しているにも関わらずこの市況の悪さ。 悲観というより違和感の方が強い。 因みにこの銀行格付けランクAAA。 http://www.arabtimesonline.com/news/nbk-leads-the-way-in-partnership-with-ripplenet/ …"
twins_naoki,2018-05-31 13:08,15,52,"▷https://www.twinsnaoki.com/2018-05-31/  ■Ripple社ホームページのパートナーがシレッと増えてた ■強盗が身代金100万ドル分のXRPを要求 ■仮想通貨が普段使いになる日が来る ■すべての人が何者にでもなれる ■cianaさんの仮想通貨マンガ 第２２話！ ■りっぴーくんLINEスタンプ第2弾でました！"
KingRippleXRP,2018-05-31 12:55,10,123,"Come on # Cryptocurrency, just give us a small 300-1100% jump so that we can start having fun again! # Ripple # XRP # Bitcoin # BTC # Litecoin # LTC"
Tokenschartde,2018-05-31 12:31,0,0,"Zahlungsanwendung Uphold hat XRP integriert Der bekannte amerikanischer Mobile-Payment-Anbieter Uphold hat das Ende der Ripple-Integration in seine Plattform angekündigt. Dies ermöglicht es den Nutzern, XRP-Adressen direkt über die Anwendung zu nutze... https://goo.gl/9kb3HL"
Tokenschartde,2018-05-31 12:30,0,0,"Ripple startet Xpring-Initiative zur Förderung von XRP-Technologien Ripple stellte ein neues Programm namens Xpring vor, das den Einsatz von XRP und Blockchain zum Ziel hat, um neue Geschäftspartner zu gewinnen. Excited to announce Xpring, a new init... https://goo.gl/Hvoxag"
BoersenMedien,2018-05-31 12:05,0,0,"# Bitcoin # BTC 0.53% # Ethereum # ETH 0.59% # Ripple # XRP -0.66% # BitcoinCash # BCH -0.33% # EOS -0.58% # Litecoin # LTC -1.91% # Cardano # ADA 0.77% # Stellar # XLM 2.64% # Iota # IOT 7.28% # Tron # TRX -5.80% # NEO 0.64% # Monero # XMR -1.96% # Dash -2.10% Daten der letzte 24STDpic.twitter.com/OfZLSmjPw8"
hitoriblog,2018-05-31 11:21,3,27,"ネットワーク構築で最も先を行ってるRipple / XRPを無視して経済圏語っても空虚でしょ"
Savior_currency,2018-05-31 11:02,2,18,"Apple Payとか、なんとかWallet〜 とかのCM増えてきたなー 時代も徐々に確実に変わってきてるね そのうちリップルもCMしだしたりして笑 # 妄想 # リップル # ripple # XRP"
ivykoinleague,2018-05-31 10:58,8,20,"REVIEW: Watch Out Ripple $ XRP, Here Comes ivyKoin $ IVY http://youtu.be/HTe-KhXIj6I # blockchain # crypto # cryptocurrency # ethereum # ERC20 # fintech # ico # ivy # ivykoin # ivykoinleague # ivyproject # ripple # xrp # xrparmy # XRPcommunity # xrpthestandard"
BCloudUK,2018-05-31 10:48,8,13,"Will $4.2bn @ EOS_io # ICO lead to 'internet of future'? @ giannilesna of @ Blocktradecom gives his view http://www.businesscloud.co.uk/news/will-42bn-ico-lead-to-internet-of-future … # cryptocurrency # BitcoinCash # xrp # Ripple # FinTechpic.twitter.com/5hEECGFfwn"
Savior_currency,2018-05-31 09:29,13,109,"XRPが一番だという確信的な自信がある。 # XRP # ripple # リップル"
russian_market,2018-05-31 08:58,5,16,"Ripple CEO says XRP is better than Bitcoin, calls Bitcoin `the Napster of Crypto` pic.twitter.com/p3zxUnBgii"
JoelKatz,2018-05-31 08:35,27,154,"You're confusing XRP with Ripple. Ripple's strategy is to settle institutional cross-border payments with an open asset so everyone can access and contribute to the liquidity."
XRPTrump,2018-05-31 21:48,43,162,"`Ana Botín, Santander Group’s executive chairman said that now 50% of the bank’s annual international transfers are carried by the Ripple-powered blockchain. ` This is the most significant achievement that people are overlooking. Ripple powered solutions are slowly taking over."
BankXRP,2018-05-31 21:44,65,194,"Rippled version 1.0.0 May 31, 2018 Today, after almost 6 years of hard work, Ripple is very pleased to announce the release of rippled version 1.0.0. https://ripple.com/dev-blog/rippled-version-1-0-0/ … # Ripple # XRP"
mochikg0207,2018-05-31 15:08,5,12,"分離課税！時間の問題！ # 仮想通貨 # リップル # xrp # ripple # ビットコインhttps://twitter.com/fujimaki_takesi/status/1002038295751094272 …"
nano_umacaccyan,2018-05-31 14:49,0,13,"66.6には 絶対何かあるな:(；ﾞﾟ'ωﾟ'): # XRP # リップル # ripple # テクノロジー # 仮想通貨 # 暗号通貨 # IYRK # Aipic.twitter.com/qeOIS0zinq"
Specco_,2018-05-31 14:27,1,12,"@ Ripple havn't had to pay you a penny for all the work you do bringing @ Ripple and # XRP to the attention of so many, you do it for free! It is a shame you don't have a bigger audience. You see, what happens in some cases is, they see your tweet, do some research, then buy XRP!"
CryptoAmb,2018-05-31 14:20,4,9,"Binance will amplify their operations to the whole of Africa https://ambcrypto.com/binance-amplify-their-operations-to-the-whole-africa/ … $ BTC # ETH $ ETH # Ripple # BTC # Bitcoin # Ethereum $ xrp # BitcoinCash # Altcoins"
futurechain2045,2018-05-31 14:10,2,7,"リップル(XRP)祭り② 三菱商事と三菱UFJファイナンシャルグループも新たな国際送金実験を開始したことを発表しましたよっと！そして、そこでブリッジ通貨（仲介）になるのが、リップル！ # 仮想通貨 # リップル # Ripple # XRP # MUFG # 暗号通貨 # 金融機関 # 投資 # 三菱商事 # UFJpic.twitter.com/53mKs5rsik"
cryptobeatz2017,2018-05-31 14:05,0,14,"【Ripple総合まとめ】 まめにチェックしといた方がいいよ〜！とくにリップルやXRPについて勉強してる人は特に！！ 僕も今から読んでこよーっと（＾ν＾） http://gtgox.com/ pic.twitter.com/SFbsjXeGsm"
Ripple_Africa,2018-05-31 13:48,1,11,"Ripple for Africa!!! And who said 100 bil was way to many XRP? https://twitter.com/Akasost/status/1001754060385644544 …"
eXrpert,2018-05-31 13:38,1,9,"仮想通貨Ａを10万円で購入。11万円で売却。 ところが値が上がり続けたので12万円で再購入。13万円で売却。 ＋2万円だけど、＋3万円の機会を逸したとも。 小まめな利確とガチホ戦略。 私はXRPをガチホしてるんですけど、どちらが堅実・確実かは意見が分かれるだろうな。 # xrp # ripple # ガチホ"
cryptobeatz2017,2018-05-31 13:28,0,13,"『Ripple Re-Brand To See XRP Listed On Coinbase, XRP Could Rise Over 200%』 https://cryptodaily.co.uk/2018/05/ripple-re-brand-to-see-xrp-listed-on-coinbase-xrp-could-rise-over-200/ …"
CWJ_News,2018-05-31 13:27,2,7,"# Blockchain Enhances # Economic Growth – # XiJingping https://www.cryptoworldjournal.com/blockchain-enhances-economic-growth-xi-jingping/ … # BCnation # BlockchainNation # CWJ # CryptoWorldJournal # Crypto # Cryptocurrency # Fintech # News # Bitcoin # BTC # Ethereum # ETH # Ripple # XRP # Litecoin # LTC # Tech # Finance # Law # Legal # Regulation # Governmentpic.twitter.com/ocuCYe6S1m"
RogueICOJournal,2018-05-31 13:22,4,6,"# Ripple trade caught @.604 Hourly tech specs bullish Now trending up short-term # XRP holds .58 support Looks to meet MA line hourly $ XRP is currently a # HODLpic.twitter.com/UJjIRgbLrK"
CryptoAmb,2018-05-31 12:50,6,13,"Ripple’s CEO says XRP will break free of Bitcoin’s [BTC] price https://ambcrypto.com/ripple-ceo-xrp-break-free-bitcoin-btc-price/ … $ BTC # ETH $ ETH # Ripple # BTC # Bitcoin # Ethereum $ xrp # BitcoinCash # Altcoins"
koinmedya_,2018-05-31 12:20,74,32,"Koinmedya Airdrop Kampanyası! Bu haberi 24 saat içinde RT eden 2 kİşiye çekilişle 50'şer # TRON ( # TRX) Hediye Ediyoruz Dikkat; Sürekli Yeni Gelişmeler Olan # Ripple’ın Fiyatında Büyük Bir Sıkışma Var https://www.koinmedya.com/2018/05/31/dikkat-patlayabilir-surekli-yeni-gelismeler-olan-ripplein-fiyatinda-buyuk-bir-sikisma-var/ … # BTC # ETH # LTC # XRP # TRX # BCH # VEN # XRP # EOS # NEO # XLM"
DigiByte_News,2018-05-31 12:04,5,17,"Report: The likelihood of # XRP being a `security,` given the fact that # Ripple has a majority holding, is strong. In the event of XRP being classified as such by the # SEC, it would have a major impact on XRP’s price and its availability on US # exchanges.https://news.bitcoin.com/ripple-wants-people-to-stop-calling-its-coin-ripple/ …"
outlaw2097,2018-05-31 11:55,1,13,"Why am I a believer in Ripple and XRP? Because of those who shun crypto and stick with traditional banking. When banks start using xRapid, they'll do it with Zerps. Money moves quicker & cheaper, while those traditional customers are paying the same fees, being none the wiser."
Ripple_Africa,2018-05-31 11:51,6,16,"Listen to the simple explanation of XRP vs Nostro Acc's https://twitter.com/BankXRP/status/1001947069517574145 …"
Gonz_xrp_gogo,2018-05-31 09:11,1,9,"年末の絶頂から暴落しつづけ、はや５ヶ月。暗澹たる暴落の中でも何故こんなに楽観していられるのか。 それは希望があるからだ。 太陽は 地平線から幸運の緑の光を放ち、今再び昇ると我々は信じている。リップルの夜明けは近い！ # XRP # Ripple # リップル # afterbitcoin # SBI # ６月pic.twitter.com/WwZbakkoji"
devnullius,2018-05-31 08:27,2,4,"Ripple CEO Says XRP is Better Than Bitcoin, Calls BTC Napster https://www.newsbtc.com/2018/05/31/ripple-ceo-says-xrp-better-bitcoin-calls-btc-napster/ …"
XRPSUPPORT,2018-05-31 21:32,0,1,"Breaking News : the Ripple powered Santander One Pay FX mobile app.: http://youtu.be/xkZcYN3x20Q?a  über @ YouTube"
CryptoGround,2018-05-31 14:41,1,2,"What is # Factom?! - A simple explaination Follow @ CryptoGround for daily updates. # cryptocurrency # bitcoin # blockchain # crypto # btc # ico # ethereum # trading # eth # market # news # airdrop # ltc # xrp # mining # usd # ripple # altcoin # litecoin # monero # coin # xlm # cryptocurrencymarketpic.twitter.com/hsxJX37060"
nano_umacaccyan,2018-05-31 14:27,1,9,"あと 34分、、 33分、、！ ギガ数が復活する(*ﾟ▽ﾟ*) # XRP # リップル # ripple # テクノロジー # 仮想通貨 # 暗号通貨 # IYRK # Ai"
FXPIPTITAN,2018-05-31 14:09,1,2,"Ripple CEO Says XRP is Better Than Bitcoin, Calls BTC Napster https://www.newsbtc.com/2018/05/31/ripple-ceo-says-xrp-better-bitcoin-calls-btc-napster/ …"
xrpthestandard7,2018-05-31 14:07,2,6,"Sweet anticipation # xrp # xrpthestandard # ripple # sbivc # sbipic.twitter.com/KHO6lLkLj8"
futurechain2045,2018-05-31 14:00,1,3,"リップル（XRP）祭り① アメリカとメキシコの金融機関がxRapidを使った国際送金のテストを行い、通常の手数料と比べると40〜70％のコスト削減を実現したと共に、本来平均2〜3日かかるのに対し、2分程度で送金が完了したことを発表しましたよっと。 # ripple # リップル # XRP # xRapid # 仮想通貨pic.twitter.com/7qbFAWngsT"
cryptopay,2018-05-31 13:45,0,27,"Our second # winner received his 750 # CPAY # prize, as promised. Check out what he had to say about the # contest and his prediction. Are you waiting for the next round? Well, we’ve changed things up a bit because next week it’ll be # XRP # Prophet! # opinion # feedback # btc # ripple pic.twitter.com/LY6oEDneBT"
gasu0093,2018-05-31 13:41,2,4,"XRPに未来を感じたのは 1.銀行のある今の経済基盤を壊す事なく改善する点。 2.PoWのような報酬だけではないネットワーク維持に永続性を感じた点。 3.政治力が非常に高いRipple社が関わっている点。 # Ripple # XRP"
waqqasalvi,2018-05-31 13:38,1,2,"$1 Million Ripple XRP Ransom Demand – Banks Should Seriously Consider Blockchain to Avoid Hacks! via @ coinpicktodayhttps://coinpick.today/1-million-ripple-xrp-ransom-demand-banks-should-seriously-consider-blockchain-to-avoid-hacks/ …"
katsuya115t,2018-05-31 13:28,2,6,"アクセルマーク テリロジー 日本一サードパーティー # crypto # btc # bitcoin # eth # etc # xrp # ltc # dash # ada # omg # blockchain # bch # btg # xmr # eos # xlm # ripple # strat # vtc # golem # etn # pivx # factom # sia # trx # sys # xvg # airdrop # ICO # icx # ven # xrb # dent # medhttp://katsuyatan.hatenablog.com/entry/2018/05/31/222728 …"
XRP_GERMANY,2018-05-31 13:25,1,5,"XRP fast Payments! # ripple # XRP @ JoelKatzpic.twitter.com/I0KmoVaAno"
xrp_is_future,2018-05-31 13:22,0,8,"その通りなんだと思います。だから、BTCとその他アルト、とされてしまっているのだと思います。Rippleの公式YouTubeの再生回数も、全く伸びてませんしね。知名度の低さ半端ないですね。"
DESTINATIONphto,2018-05-31 12:44,1,3,"39billion tokens with one use...to sell when Brad, a conman aka # codecon , pumps the price so he can sell that worthless crapcoin called $ XRP to fund Ripple operations. Don't buy the fallacy and dont be fooled by the conman."
QuantumPanda1,2018-05-31 12:10,0,10,"@ aaronlammer is incredibly diplomatic as he navigates his way through some of the tougher questions. @ kieranmlkelly responds gracefully and presents a balanced view on # XRP and @ Ripple, all from the position of a well researched, educated investor and enthusiast! Well done both!"
BWCevent,2018-05-31 11:41,2,5,"Get your tickets now! Don’t miss out on the experience of a lifetime . . . . # btc # bitcoin # ripple # xrp # ethereum # litecoin # HODL # blockchain # blockchaintechpic.twitter.com/MOnMvuCDKc"
arndtpodzus,2018-05-31 11:30,2,5,"Very Bullish! We crossed the starting line..... # Ripple # XRP # XRPTheStandardhttps://twitter.com/The_Mainlander/status/1002147581651136512 …"
JustCrypto101,2018-05-31 10:54,1,4,"On which side will you stand..I've always said it.. If you support and invest in @ ripple the you're a fool and are supporting the banks! # xrp # xrparmy # XRPcommunity # Ripplenews # BTCP $ btcphttps://ethereumworldnews.com/bitcoins-btc-dominance-could-end-soon-says-ripples-xrp-ceo-brad-garlinghouse/ …"
CantonaUnited80,2018-05-31 09:52,1,3,"Spread the word # xrp # ripple @ Bloomberg @ GoldmanSachs @ coinbase @ coindesk (A.K.A. Fuddesk) # cryptocurrencynews # cryptocurrencyhttps://twitter.com/ecossexrp1/status/1001535539122753539 …"
CoinGapeMedia,2018-05-31 09:32,4,11,"Ripple XRP CEO Brad Garlinghouse talked about the momentum it is gaining and how it is different from mainstream stocks and other digital assets. @ Ripple @ RippleFeed # XRP # cryptocurrency # altcoinshttps://coingape.com/ripple-xrp-momentum-xrp-price-to-roof/ …"
Akasost,2018-05-31 20:53,8,13,"So @ TwitterSupport I tweet today outing @ CNBCFastMoney for getting facts wrong with # xrp and @ Ripple and that tweet mysteriously disappears. Censorship? Has anyone else been “twitter censored or experienced anything similar such a wrong shadow ban etc? # xrpcommunity # xrp"
BankXRP,2018-05-31 20:45,105,293,"Ripple Watch a transaction from start to finish on the Ripple powered Santander One Pay FX mobile app. # Ripple # XRP pic.twitter.com/ZgYgR4smmp"
ToshiTimes,2018-05-31 15:25,1,4,"Hackers Demand $1 Million in XRP in Exchange of Stolen Bank Data # Blockchain # Ripple https://toshitimes.com/hackers-demand-1-million-in-xrp-in-exchange-of-stolen-bank-data/ …"
XRPTrump,2018-05-31 15:24,0,7,"You asked why people were excited about XRP. One of the reasons people are excited about XRP is because the low latency, low fee settlement makes micropayments feasible. A use case that @ Coil is exploring & people like @ WietseWind made this app to exploit that. +.0001 @ xrptipbot"
XRPTrump,2018-05-31 15:21,0,3,"Btw Aaron you might not like the XRP balance you have not because of the 5 XRP tip you got from Robert! and if you want to withdraw your tipbot balance then you can go here. click http://xrptipbot.com  login using twitter! Done! Of course, we'd love it if you tip others :)"
joemccann,2018-05-31 15:09,0,2,"Getting Started With Ripple (XRP) and Node.js http://www.thecodebarbarian.com/getting-started-with-ripple-xrp-and-node-js …"
GbrilliantQ,2018-05-31 14:53,2,2,"Ripple CEO Garlinghouse: Bitcoin Price Won’t Correlate With XRP Price Forever http://dlvr.it/QVkjD7 $ BTC $ LTCpic.twitter.com/wv9Z0iqqet"
Ripp1e_moon,2018-05-31 14:01,0,3,"ショートするならBitMEX ！！　レバ最大100倍 取り扱いアルト：(ETH)、Ripple(XRP)(BCH)(ADA) 追証なし（借金リスク０） ロスカット：証拠金０ 口座開設約１分 http://bitmex.com/register/d0dUTz"
ItsJabaaa,2018-05-31 13:45,0,8,"If # BTC is the Napster of the space, Ripple # XRP is the alternative nobody remembers the name of https://twitter.com/SalihSarikaya/status/1002052887067873280 …"
statesupervisch,2018-05-31 13:17,0,2,"XRP deflationary. Over time XRP price will increase. But given everyone knows its deflationary, who will use XRP for utility? Higher potential profit by saving, converts to less incentive to use XRP. UNLESS, Ripple DISTRIBUTES XRP to central banks."
GaelXrp,2018-05-31 12:44,0,4,"There might some confusion about @ Ripple & # XRP for the unwilling to learn, but it’s also reassuring to know that there is a solid legit actual company with a known brilliant team behind it... and not just the Chinese Govt or some obscure group of dev hidden somewhere...."
Truthbot1666,2018-05-31 12:41,0,3,"Well sad you still know nothing yhen anout ripple or xrp - now if you said jed and xlm ill agree as that is jed scam - and fact is if the product works and saves trillions then why cant the founders benefit -"
jyohotaro,2018-05-31 11:12,0,3,"なかなかの材料じゃ上がらないなら、CCの基軸スタートも視野に入れたいよね たくさんの投票お願いします # XRP # ripple # リップルhttps://twitter.com/jyohotaro/status/1002140838644760578 …"
mwill_crypto,2018-05-31 10:31,0,1,": https://cryptocoinspy.com/ripple-ceo-appears-on-cnbc-major-tech-conference-couldnt-disagree-more-with-ethereums-vitalik-buterin/ … via @ CryptoCoin_Spy The @ Ripple CEO appeared on @ CNBCFastMoney, CNBC's # PowerLunch, and a major # tech invite-only conference on Wednesday $ XRP # CryptoNews # Crypto"
devnullius,2018-05-31 10:24,0,3,"‘Bitcoin’s (BTC) Dominance Could End Soon’, Says Ripple’s (XRP) CEO, Brad Garlinghouse https://ethereumworldnews.com/bitcoins-btc-dominance-could-end-soon-says-ripples-xrp-ceo-brad-garlinghouse/ …pic.twitter.com/a6pxigSLzn"
IGSquawk,2018-05-31 09:10,4,5,"Crypto update: # BITCOIN 7530.19 +2.59% # ETHER 569.18 +3.7% # BITCOINCASH 1006.25 +3.92% # RIPPLE 0.609 +3.54% # LITECOIN 119.52 +2% # BTC # ETH # BCH # XRP # LTC"
KasparHaus,2018-05-31 09:00,0,3,"I am impressed by this! A great event, the future belongs to TRON, wait for big news. Justin Sun and the team are working - TRON will be great! HODL! # trx # tron # bcn # icx # ven # cryptocurrency # ltc # xvg # ripple # btc # iota # monero # eos # neo # eth # CyberMiles # bnb # dash # xrp pic.twitter.com/lqFUy8wnxF"
marccwr,2018-05-31 08:52,0,3,"No evidence banks NOT willing to use XRP once right regulation is there. In the mean time OTHER FI's already showing STRONG interest in # XRP by testing # xRapid. @ Ripple is the only in crypto space with a clear focus on a real use case 4 their coin as the masterpiece of the plan"
mghgtn,2018-05-31 08:24,0,2,"Ripple CEO Says XRP is Better Than Bitcoin, Calls BTC Napster During a panel discussion at yesterdays Recode Code Conference in which blockchain, digital assets, and cryptocurrencies were on the program Ripple’s CEO called out Bitcoin as an idea that te… https://www.newsbtc.com/2018/05/31/ripple-ceo-says-xrp-better-bitcoin-calls-btc-napster/ …"
CryptoInvest18,2018-05-31 20:41,172,408,"The markets are back growing again! Whats the best altcoin to buy today?? 24h vote! # verge # xvg # tron # trx # ripple # xrp # electra # eca # miota # iota # stellar # monero # cardano # ada # nem # xem # ethereum # eth # bitcoin # btc # crypto # cryptocurrency # ripple # xrp # eos # neo # ico # bytecoin"
KateyKomics,2018-05-31 20:34,5,7,"@ KidCrypto1 is enthralled by # renewableenergy as being touted as solution to # bitcoinmining waste. Here is why....... http://www.darkstreet.org/2018/05/cure-to-bitcoin-energy-woes-green.html … # cryptocurrency # mining # cardano # proofofstake # ethereum # ripple # xrp # cryptonews # Flippeningpic.twitter.com/j2vspQZAgL"
RobertLe88,2018-05-31 15:14,0,3,"You are so kind, xrp ait time, but i dont think xrptrump is reasonable given the xrpfireburnshot @ aaronlammer +5 @ xrptipbot"
Ripp1e_moon,2018-05-31 15:10,0,3,"リップルはBTCと連動しなくなるというのは、つまりＸＲＰが基軸となりBTCと入れ替わるということやな！世代交代は近いぞ！！ そのままぶち抜けRipple！！"
Specco_,2018-05-31 14:06,1,2,"Why promote yourself on Twitter when your understanding of Ripple and XRP is about as clear as a muddy puddle. # xrpthestandard"
CryptoHype5,2018-05-31 13:47,1,2,"New Free Bitcoin Cash faucet pays good!!! Check it out!!! http://moonbitcoin.cash/?ref=835CE4D93A3D … # BTC # ETH # ICO # TRX # XVG # XRP # crypto # Coinbase # coins # blockchain # Binance # Yobit # Bitcoin # ethereum # Mining # LTC # tokensale # tokens # Ripple # Bitcoinz # LitecoinNation # bitcoinnews # BitcoinCash"
criptoinforme2,2018-05-31 13:28,0,3,"El CEO de Ripple dice que XRP se liberará del precio de Bitcoin (BTC) - https://criptoinforme.com/el-ceo-de-ripple-dice-que-xrp-se-liberara-del-precio-de-bitcoin-btc/ … @ Criptoinforme3 # Criptomonedas # Noticias # Trading # Cryptocurrency # Cryptonews # cryptotradingpic.twitter.com/ipfWKL6j0I"
statesupervisch,2018-05-31 13:20,0,2,"We advocate massive transfer of XRP by Ripple to Fed, China State Bank, Central Bank of Tokyo, and IMF. XRP should be adopted as global currency."
cryptodailyuk,2018-05-31 13:18,1,1,"# Ripple Re-Brand To See # XRP Listed On # Coinbase, # XRP Could Rise Over 200% Read more: https://cryptodaily.co.uk/2018/05/ripple-re-brand-to-see-xrp-listed-on-coinbase-xrp-could-rise-over-200/ …"
KasparHaus,2018-05-31 12:43,2,5,"Patience! HODL TRON and do not sell! # TRX # TRON # bcn # icx # ven # cryptocurrency # ltc # xvg # ripple # btc # iota # monero # eos # neo # eth # CyberMiles # bnb # dash # xrp pic.twitter.com/r75DWuluJd"
sniperstube,2018-05-31 12:30,5,6,"# Ripple ( # XRP) Test a ‘Resounding Success’ Says # UK Foreign # Exchange Firm! # crypto # cryptocurrency # cryptonews # cryptoupdate # technology # innovationhttp://ow.ly/Mdvx30kgu0T"
arndtpodzus,2018-05-31 12:14,1,1,"It's all over the news! Bitcoin is like Napster: an important flop, Ripple CEO says https://cnet.co/2kEeuq6  via @ CNET # Ripple # XRP # XRPTheStandard"
miss_ripple,2018-05-31 12:08,0,9,"$ XRP 1h ピンクのラインはEWとはいえないんでしょうけど .... BTCの下落なければこういう形もアリなんじゃないかな　ぁと。 pic.twitter.com/0vkMdd5wvH"
FxproBy,2018-05-31 11:53,1,1,"Криптовалюта Ripple (XRP/USD) прогноз на 1 июня 2018: Котировки Ripple XRP/USD торгуются на… https://goo.gl/fb/35m67B"
mugencoin,2018-05-31 11:23,0,2,"ネテロ会長の必殺技が発動するのかな？ $ XRP # XRP # Ripple # リップルpic.twitter.com/jIDDQJJMDE"
chewiecoin,2018-05-31 10:26,0,3,"Yes absolutely. Rather than trying to develop all of these new programs and use cases themselves, Ripple uses their war chest of XRP to fund tech start ups that will ultimately use XRP. Genius. It’s a self fuelling machine."
CJ79357723,2018-05-31 10:15,0,2,"Not hipsters, hypsters, shilling away. Same as tron. I’d love be to see xrp hit $3.00. But reality is I’d buy bitcoin with it. I got in early also so hodl for now."
angermannerich,2018-05-31 08:50,0,2,"Sign up and get up to $250 in # Crypto # ETH # BTC # NEO # EOS # LTC # BCH # XLM # XRP # XLM # TRX # XVG # ADA # Bitcoin # Bitcoins # BitcoinCash # Ethereum # Ripple # Litecoin # Cardano # Stellar # Iota # Miota # Tron # Monero # Dash # Nem # XEM # Tether https://bit.ly/2ri7YIw"
GigaBitcoin,2018-05-31 08:45,1,2,"Ripple CEO Says XRP is Better Than Bitcoin, Calls BTC Napster https://www.newsbtc.com/2018/05/31/ripple-ceo-says-xrp-better-bitcoin-calls-btc-napster/ …"
