username,date,retweets,favorites,text
C3_Nik,2018-05-22 13:44,6,58,"Hype spreads like wildfire, whereas hard (boring) facts are not spread as much. This creates a filter bubble which can lead investors to bad decisions and over commitment. Please tame your expectations a bit. That way you cannot be disappointed. # xrp # xrpcommunity # ripple"
kriptokoin,2018-05-22 13:39,1,8,"Artık Litecoin ve Ripple İle De Uçulabilecek! https://kriptokoin.in/artik-litecoin-ripple-ile-de-uculabilecek/ … $ XRP $ LTCpic.twitter.com/vmFckaGHVz"
Rhogew,2018-05-22 13:37,9,23,"All thanks to the # XRPCommunity efforts, @ Tapjet will implement # xrp (and also # ltc) payment options, as soon as June 1st 2018: https://toshitimes.com/book-your-private-jet-with-ripple-and-litecoin/ … @ AlexCobb_ keep this link to remind yourself for when # WhenBora happens # xrp # ripple # xrparmy"
Hodor7777,2018-05-22 13:31,338,773,"# xrp is the undisputed best choice for long-term investors. why? It's all in today's blog! https://xrphodor.wordpress.com/2018/05/22/xrp-the-best-crypto-choice-for-long-term-investors/ … @ haydentiff @ JoelKatz @ bgarlinghouse @ Interledger @ ripple @ CoryTV # xrpthestandard # xrparmy # xrpcommunity # cryptocurrency # Crypto # banking # fintech # TechTrends"
Chris_DMLab,2018-05-22 13:31,2,6,"Hey @ clairearthurs I m a huge fan of @ Ripple & of course # XRP, I currently run a local community football club here in the UK, @ BelmontWandFC are on a mission to raise funds for a new clubhouse, read our story here - https://goo.gl/R4ZmcS  Can the # XRPCommunity help us out?"
Ripple_Africa,2018-05-22 13:26,1,10,"My investment is LONG term! See what the Grand Master says on @ Ripple XRP: The Best Crypto Choice for Long-Term Investors https://xrphodor.wordpress.com/2018/05/22/xrp-the-best-crypto-choice-for-long-term-investors/ … via @ wordpressdotcom"
mGAMERdude,2018-05-22 13:21,2,15,"“Their focus on gaining real-world partnerships with major financial institutions is paying off... Ripple boasts an entire suite of functional products... Ripple is primed to lead the charge.” https://globalcoinreport.com/apple-inc-nasdaqaapl-integrates-ripple-xrp-interledger-technology/ … # xrp # ripple # xrpthestandard # xrparmy # xrpcommunity"
BankXRP,2018-05-22 13:13,8,36,"A new wave of ICOs? Toast Wallet adds support for ICOs on XRP Ledger! https://ambcrypto.com/new-wave-icos-toast-wallet-support-icos-xrp-ledger/ … # Ripple # XRP"
bitbit_ojin,2018-05-22 13:04,4,10,"This Airline Company Allows You to Pay With Ripple (XRP) and Litecoin (LTC) https://coindoo.com/this-airline-company-allows-you-to-pay-with-ripple-xrp-and-litecoin-ltc/ …"
bitcoinagile,2018-05-22 13:03,2,9,"r/Ripple - Ripple XRP - The Big Money Machine # Ripple # BigMoneyMachine # tron # trx # xrp # eth # btc # xmr # ltc # litecoin https://www.reddit.com/r/Ripple/comments/8l93q8/ripple_xrp_the_big_money_machine …pic.twitter.com/eA0f8Q9iXS"
gox_crypt,2018-05-22 12:59,12,46,"米国に本拠を置く民間航空機のレンタル会社TapJetsは、支払いシステム内でRipple（XRP）とLitecoin（LTC）を採用 https://coindoo.com/this-airline-company-allows-you-to-pay-with-ripple-xrp-and-litecoin-ltc/ …"
C3_Nik,2018-05-22 12:08,21,106,"Ripple mentioning Amazon and Uber in their presentations neither confirms,nor denies that they are working with them. # xrp # xrpcommunity # ripple # xrpthestandard"
BoersenMedien,2018-05-22 11:50,0,0,"# Bitcoin # BTC -1.77% # Ethereum # ETH -1.38% # EOS # EOS -2.71% # BCH -4.53% # Tron # TRX -0.44% # Litecoin # LTC -1.07% # Ripple # XRP -1.13% # Qtum -3.50% # ETC -2.20% # Binance # BNB 6.82% # ZCash # ZEC 0.85% # NEO -3.81% # Dash -4.02% # Bytom # BTM -4.13% # VeChain # VEN -0.59% Daten der letzte 24spic.twitter.com/kzD6gOb3jc"
GiantGox,2018-05-22 11:37,146,357,"`ジャスティン・ビーバーのマネージャーとして有名なScooter Braunは、「XRPを使ってアーティストのマネタイズやコンテンツ管理を支援できるような方法を模索している」。` XRPエコシステム構築に向けて動き出したリップル | TechCrunch Japan https://jp.techcrunch.com/2018/05/19/2018-05-14-ripple-xpring/ … # Ripple # xrpthestandard"
blcurley,2018-05-22 11:33,3,19,"Opinion: Any and all regulations will not be sneaking up on Ripple or their digital asset XRP any time soon. @ kieranmlkelly @xrphunter @ CryptoPennyCO @ HaraldoXRP @ Hodor7777 @ ekpethedragon @ XRP_DANhttps://twitter.com/blcurley/status/998888875736084480 …"
bigbuckor,2018-05-22 11:31,1,18,"I'm beginning to think CoinDesk doesn't like Ripple or XRP (end sarcasm)."
mGAMERdude,2018-05-22 11:30,4,21,"“ERC20 tokens had a positive influence on the value of ETH. So widespread use of Ripple ledger tokens might have a positive influence on XRP.” | # xrp # ripple # xrpthestandard # xrparmy # xrpcommunityhttps://twitter.com/toastwallet/status/998782936840204288 …"
edisss88,2018-05-22 11:04,7,84,"Away on vacation for a few days, back on twitter with a conclusion, there are three certainties in life: 1. Death 2. Taxes 3. FUD against XRP # XRPcommunity # XRP # Ripple"
lovexrp,2018-05-22 11:01,6,7,"そういえば、Apple Pay支払いにRippleインターレジャーAPIを導入とのニュースがあった。 http://infofreestyle.com/apple-pay-ripple-xrp-ilp … それに関し「XRPが多くの人々の手の届かないところへ行っちゃうのも時間の問題」な投稿。 そだね 例えばSBI取引所が開設されたらどうなるかなあ https://coperu-100.com/kasotsuka/ripple/sbivc-prices/ … # XRP https://twitter.com/ocean_4549/status/998834196717043712 …"
TheCryptoLark,2018-05-22 10:56,9,15,"# ripple $ xrp - saving big banks money @ Ripple http://youtu.be/VhuAKXLiXSk?a"
BlockExtreme,2018-05-22 10:51,1,24,"Hey @ BancoMasventas BitcoinCash $ BCH is the best solution for your cross-border payment solution. It allows over 200 transactions per second and has security backed by PoW unbreakable sha256d. Ripple $ xrp is 2004 tech. I wouldn't advise taking this big step with that tech."
coinschedule,2018-05-22 10:49,224,252,"Best Privacy Coin? Vote and Retweet! http://coinschedule.com # crypto # cryptocurrency # monero # xmr # dash # verge # xvg # deeponion # onion # zcash # aeon # navcoin # nav # Komodo # airdrop # pivx # stellar # xlm # nem # xem # ripple # xrp # tron # trx # altcoins # bitcoin # btc # zencash # cardano"
diesel_stefan,2018-05-22 10:13,4,5,"# Akamai and MUFG to Revolutionize Japan’s Banking System # xrp # ripple # xrpthestandard # Coinbase # IBMhttps://bitrazzi.com/akamai-and-mufg-to-revolutionize-japans-banking-system/ …"
kryptolinks_de,2018-05-22 09:49,0,0,"22.05.2018|de.investing: Ripple (XRP/USD) Kursanalyse: Kurzfristig ist ein Dreieck im Spiel -> https://de.investing.com/analysis/ripple-xrpusd-kursanalyse-kurzfristig-ist-ein-dreieck-im-spiel-200223588 … @ kryptolinks_de # kryptolinks # kryptolinks_de"
DailyFX_DE,2018-05-22 09:48,0,1,"# Ripple: Kurzfristig ist ein Dreieck im # Spiel https://bddy.me/2IULrwl # XRP # XRPUSD @ SalahBouhmidi @ DavidIusowpic.twitter.com/e0TbMICzB5"
CryptoAmb,2018-05-22 09:36,4,9,"Innovations underway? 7th Stellar Lumens [XLM] build challenge upcoming! https://ambcrypto.com/innovations-underway-stellar-lumens-xlm-build-challenge-upcoming/ … $ BTC # ETH $ ETH # Ripple # BTC # Bitcoin # Ethereum $ xrp # BitcoinCash # Altcoins"
crypto_sarah9,2018-05-22 09:06,9,12,"In the last week, the depreciation was slow now that Ripple sellers are finding resistance at 60 cents. Check it out http://crypt.click/Ripple60c # Ripple # Cryptocurrency # XRP # Blockchain"
coinexcom,2018-05-22 08:36,25,61,"CET Airdrop to New coin balances: Ripple (XRP) @ Ripple https://www.coinex.com/announcement/detail?id=46 …pic.twitter.com/uG0Sshszsc"
johnlorenz007,2018-05-22 08:34,13,19,"# Giveaway 500k Kin tokens Like Retweet Join https://goo.gl/Gm6ygq  Comment your ether wallet address Winner chosen this Wednesday at 12pm # bitcoin $ XLM $ BTC # dash $ XVG # eth # verge # crypto # ico # xrp $ ADA $ TRX # Binance # airdrop # litecoin # BTC $ LTC $ ETH # ltc # ripple # XVG $ XRP pic.twitter.com/CGFj4yBWhj"
ToastWallet,2018-05-22 08:28,2,15,"ERC20 tokens had a positive influence on the value of ETH. So widespread use of Ripple ledger tokens might have a positive influence on XRP."
xrpmoonboiz,2018-05-22 08:15,0,10,"Apparently I am shadow banned as well...hopefully can get this resolved soon # XRP # Ripple # xrpthestandard # xrpcommunitypic.twitter.com/viqRLdcmM5"
SVK_Crypto,2018-05-22 07:54,6,11,"Hi guys... here is a little summary of consensus New York... https://youtu.be/jACMPSzY024 # Consensus2018 # BlockchainWeekNY # bitcoin # blockchain # crypto # ethereum # BTC # ICO # fintech # news # altcoin # Airdrop # cryptocurrency # IoT # AI # BigData # eth # news # tokensale # litecoin # xrp # ripple"
tyandooo,2018-05-22 07:51,2,7,"「Maybe This Will Allow Ripple XRP To Take Over Visa And Mastercard 」 もしかしてだけど、もしかしてだけどー！っていう記事。maybeとかrumoursって単語だけでもお察しですが、MFチェインなるものの動きについては初耳（昨日発表だからか） https://cryptodaily.co.uk/2018/05/maybe-will-allow-ripple-xrp-take-visa-mastercard/ …"
BankXRP,2018-05-22 07:40,94,209,"Toast Wallet announced on Twitter that they would be adding support for a feature known as “Issue Own Currency” next week. This feature would allow users to issue an ICO on the Ripple network. https://ambcrypto.com/new-wave-icos-toast-wallet-support-icos-xrp-ledger/ … # Ripple # XRP"
Ripple_Africa,2018-05-22 07:39,40,99,"GO Ripple!!! Ripple (XRP) May Outperform Bitcoin (BTC) And Ethereum (ETH) Again In 2018 https://cryptodaily.co.uk/2018/05/ripple-xrp-may-outperform-bitcoin-btc-ethereum-eth-2018/ …"
NLess2756683,2018-05-22 07:33,3,1,"“Only the most liquid and established crypto currencies are offered through LMAX Digital: Bitcoin, Ethereum, Litecoin, Ripple and Bitcoin Cash.” $ XBT, $ ETH, $ LTC, $ XRP, $ BCHhttps://twitter.com/lmax/status/998483137603756033 …"
indaseitai,2018-05-22 07:31,11,14,"当店は仮想通貨決済取り扱い店です。 今なら仮想通貨決済限定でお会計２０％ＯＦＦ！！ トレードで疲れたカラダを整えにいらっしゃって下さい☆ 印田整体院 http://inda-seitai.com/ # BTC # BCH # XEM # MONA # BitZeny # XP # QASH # nem # XRP # XVG # Ripple # vergepic.twitter.com/aEL2pdIBZr"
JohnMatthewsDub,2018-05-22 07:24,0,3,"The survey report suggests that Ripple (XRP) is the most successful cryptocurrency over the world. https://twitter.com/ripplecoinnews/status/998570951984996352 …"
XRPworld,2018-05-22 07:24,22,98,"The next bull run will be even crazier than the last one!!!! # XRP # Ripple # crypto # bitcoin # cryptocurrency"
FinnTechFwd,2018-05-22 07:19,2,3,"A bakery in Zurich only accepts digital payments like bitcoin | # Crypto # Cryptocurrency # Bitcoin # Ripple # Ethereum # ICO # Blockchain # AI # IoT # Data # Tech # Technology # FinTech # RegTech # InsurTech # Regulation # Trading # Digital # Mining # WomenInTech # BTC # XRP http://www.finntechfwd.com/zurichs-bitcoin-bakery/#comments …"
CryptoHype5,2018-05-22 07:12,7,3,"account update and proof of withdraw # minerfarm is 100% legit.!!!! http://www.minerfarm.com/login?r=48454#toregister … # Like & # Retweet # BTC # ETH # ICO # TRX # XVG # XRP # Litecoin # crypto # Coinbase # coins # blockchain # Binance # Yobit # miner # Bitcoin # ethereum # Mining # LTC # tokensale # tokens # Ripple # Bitcoinzpic.twitter.com/kYyOP2fsrf"
fourthjohnxrp,2018-05-22 07:06,2,10,"`LMAX Digital delivers a market-leading solution for physical trading and custodial services for the most liquid crypto currencies - such as Bitcoin, Ethereum, Litecoin, Bitcoin Cash and Ripple.` # XRP # RIPPLE # LMAXExchangeGroupInstitutionalhttps://twitter.com/rippletrippleba/status/998667144723423232 …"
Dave_Jonez_02,2018-05-22 07:04,1,6,"Polysign, an enterprise and institutional-grade custodial # crypto service, including @ JoelKatz and Arthur Britto on the tech side, *could* indeed turn out to be part of # Xpring. Interesting. Looking forward to more announcements from @ Ripple. $ XRP # XRP https://twitter.com/lukeeboy/status/998793704897896448 …"
Urfamat2,2018-05-22 07:03,8,8,"Güzel bir bedava # dogecoin sitesi 19.05.2018 bakiye resimde Sizde linkten kayıt olabilir mısınız siz # btc # bitcoin # crypto # cryptocurrency # ltc # litecoin # eth # ethereum # xrp # ripple # coinbase # bitcoinnews # cryptonews # btcusd # bitcoinprice http://freedoge.co.in/?r=2416911 pic.twitter.com/oyQIEMw5hB"
NordicAnn,2018-05-22 06:45,9,26,"So if the CFTC argues that digital currencies are commodeties, we are getting closer to a an answer on the whole securities debate... Read Katherine’s thread! # xrp # xrpthestandard # ripple https://twitter.com/katherineykwu/status/998657530174812161 …"
DailyFXTeam,2018-05-22 05:42,3,3,"Crypto update from IG: # BITCOIN 8279.39 -1.51% # ETHER 685.84 -1.75% # BITCOINCASH 1189.95 -3.96% # RIPPLE 0.666 -1.57% # LITECOIN 133.09 -1.45% # BTC # ETH # BCH # XRP # LTC"
lukeeboy,2018-05-22 05:36,1,7,"Yet again Coinbase is planning to apply for a bank license and I would imagine they would use @ Ripple's solution if they got the license.. Regardless, the # XRP HODLers/ # XRPCommunity will win either way"
KingRippleXRP,2018-05-22 05:10,6,40,"Most (not all) # Cryptocurrency and # Altcoins exist just to take your # Bitcoin. # Ripple # XRP exists not to take your Bitcoins, but to revolutionize the way Banks transfer and settle funds. For about $0.66, we all can be part of the Revolution. Time is key."
XRPTrump,2018-05-22 04:56,11,34,"Please Follow @ YassinMobarak whose account @Dizer_Y was banned by twitter! He created a new one! He's an old XRP and Ripple supporter! You can see his pictures from the # XRPCommunity night! cc: @ haydentiffhttps://twitter.com/YassinMobarak/status/998782123740942336 …"
DanPallatina,2018-05-22 04:55,3,23,"It’s funny, you tell friends and family to invest in # ripple # XRP. But they don’t want to risk any money. If you make £10,000,000 profit I guarantee they will all want you to give them some."
lipton_milk999,2018-05-22 03:59,61,191,"ブリッジ通貨のXRP、音楽も流せる台帳ILP、ブラウザから1円の支払いができるCoil、スマートコントラクトCodius、そしてそれを開発するベンチャーを募るXpring、銀行の実例。全部繋がるとどうなるか。リップラーが支持するのそこだと思う。 # XRP # ripple # リップル # 仮想通貨 # cryptocurrencies"
Truthbot1666,2018-05-22 03:47,2,9,"Just as ripples spread out when a single pebble is dropped into water, the ripple affect will grow pushing the # xrp adoption far and wide with banks websites shops phones ever Credit cards able to use xrp the ripple affect will be the storm that has no end # XRPCommunity # xrparmypic.twitter.com/joRMRZuVFe"
coin_coin2ch,2018-05-22 03:37,22,35,"仮想通貨注目度上昇率ランキング 【1位】$NANJ(なんJコイン、NANJコイン、NANJCOIN) +78.3% 【2位】$ETH(イーサリアム) +65.4% 【3位】$XRP(リップル、Ripple) +60.5% 【4位】$BCH(ビットコインキャッシュ) +54.8% 【5位】$XEM(ネム、NEM) +54.5% (12時間毎計測) https://cryptocurrency-real.com/?rate=1"
lipton_milk999,2018-05-22 03:17,35,87,"リップルの中でも、私が期待してるリップルのスマートコントラクトCodiusについてです。 イーサリアムはスマコンが良いなと思ってたんですが、XRPでも良い線行ってるなと。 # XRP # リップル # ripple # 仮想通貨 Codiusとは？XRP(リップル)でスマートコントラクトを開発可能に https://rizalog.com/cryptocurrency/codius-detail/ …"
AvciBalinalar,2018-05-22 03:04,12,61,"Bugün hangi coin 'i inceleyelim? Konu altına talepleri alalım. (RT yapanları dikkate alacağım) Son 8 günlük analizler : Bitcoin $ NEBL $ Storm $ PPT # Populous $ BTC # Bitcoin $ TRX # Tron $ EOS $ STRAT # Stratis $ XRP # Ripple $ ETH # Ethereum $ IOTA # MIOTA $ ADA $ WTC # Walton $ LTC # Litecoin"
crypto_sarah9,2018-05-22 02:59,12,39,"`Could These Reasons Take # Tron ( # TRX) To Coinbase Ahead Of # Ripple ( # XRP)?` http://crypt.click/AltRace"
haydentiff,2018-05-22 02:44,7,83,"1. Know how to use a config file to steal other people’s ripples. 2. Know how to freeze XRP *only* when nobody is looking. 3. Know how to pace yourself when printing more XRP. 4. Never let a day go by that you don’t interrupt a conversation to blurt out “XRP is a security!” https://twitter.com/rbrtbrgnjn/status/998717620651249665 …"
jungleincxrp,2018-05-22 02:34,23,138,"XRP has to have the single greatest community and collection of genuine and down to earth people. I think it’s a reflection of the hard working people at Ripple. They focus on what really matters: changing the world for the better. Not artificially inflating the price."
mGAMERdude,2018-05-22 02:30,26,105,"# XPRING | Just made this XPRING graphic for the @ Ripple / # XRP community. Share, Promote, & Enjoy the Ride... Adoption continues with the #1 Digital Asset on Planet Earth | # XRPCommnity # XRPArmy # Ripple pic.twitter.com/W0x3sDpMox"
Vince102tw,2018-05-22 02:25,3,9,"Lost my previous account months ago for posting a few animated ripple gifs. I don't post much. Mostly follow/like # xrp. That said, recently noticed that I'm having too refollow ppl that I'm 99% sure I was already following. Weird. R they banned o being removed frm my follw list? pic.twitter.com/lXKPT4KD70"
coin_choice,2018-05-22 02:14,9,11,"リップルは海外送金などでも今後が期待されるプロジェクトの1つ。様々な企業と提携を結ぶなど勢いは増す一方。企業、個人ともに世界的にニーズもあるXRPの将来について、海外メディアで紹介されていた内容を五月雨まくら氏( @ samidare_makura)が解説。 # リップル # XRP # Ripple https://coinchoice.net/ripple-xrp-future-reasons/ …"
XRPworld,2018-05-22 02:14,7,13,"# XRP World Podcast | Episode 5 | Upgraded Mics, CoinDesk & # xrpcommunity, Demographics for # crypto & # ripple, and more! Shout out to @ xrptips for all the hard work! https://bit.ly/2IDjpWM # xrpthestandard Thank you @ LfmVanillaWoW & @ MorPeretz6"
MummyVx2,2018-05-22 02:13,9,82,"Just remember great projects take time to succeed... Just like a new business can take up to 3+ years to make profits. Moral of this story is..... “Good Things Take Time” # HODL # XRP # ripple # CryptoNews # investing # takestime # cryptocurrency # XRPCommunity pic.twitter.com/dlLQWUnPKN"
cannavinothc,2018-05-22 01:52,9,68,"Rippleは世界中の銀行や送金業者に自社のシステムを利用してもらうことでそれらをILPで繋いでXRPという資産を世界中の通貨の橋渡し役として使われるようにするんや！！！そうなってこそ銀行のノストロ口座に死蔵されてるカネも生きるんや！！！"
GPpharmtoken,2018-05-22 01:48,1189,796,"GP Pharm GPP is airdropping 10,000 GPP tokens worth $500, you will also earn up to additional 1000 GPP tokens worth $50 by referring friends. Join Here => http://bit.ly/GPPairdrop # airdrop # bounty # BTC # xrp # freetoken # Crypto # ETH # NEO6 # Blockchain # ripple # trx # tron # binance"
AlexCobb_,2018-05-22 01:37,10,51,"Ripple XRP: The Final Piece of the Puzzle, make sure to check this out! https://www.youtube.com/watch?v=3FcfAqAx2S0&feature=share …"
_83328_,2018-05-22 01:25,14,108,"私はripple社の養分ですよぉ〜！ どんどんripple社に養分を与えてどんどん成長させて、大木になって、花が咲いて、果実が熟れた頃に美味し〜い思いをさせていただきます！ 美味しい思いをするには今XRPを買わなきゃいけないんですよぉw https://twitter.com/kotemugi89/status/998464030166548480 …"
RyanLibertyPawn,2018-05-22 00:54,29,89,"$ XRP's daily chart is also leading me to be bullish. # Ripple is showing the CCI diverging upward from the RSI. This is a good sign that usually precipitates a sizable move up. # XRPCommunitypic.twitter.com/yaRO8btBpq"
ThinkingCrypto1,2018-05-21 23:35,6,16,"London Block Exchange XRP GBP Pairing - Uphold Full XRP Support on 5/24 - BAT Brave Gets TV Coverage https://www.youtube.com/watch?v=MrIks2I-ym0 … @ ripple @ UpholdInc @ LBXSocial # xrp # ripple # bat"
mGAMERdude,2018-05-21 23:27,10,29,"“Ripple (XRP) is, “Ahead of its time.” Ripple as a company has surprised many with how aggressively and tactfully they have captured the market and established their foothold | https://cryptodaily.co.uk/2018/05/ripple-xrp-may-outperform-bitcoin-btc-ethereum-eth-2018/ … | # xrp # ripple # xrpthestandard # xrparmy # xrpcommunity"
XRP_Europe,2018-05-21 22:50,15,26,"# Apple’s partnership with # Ripple could send it through the roof https://globalcoinreport.com/apple-ripple-partnership-could-send-xrp-price-through-the-roof/ …"
coinpricenow,2018-05-21 22:22,1,5,"1 Bitcoin ( # BTC ) Dollar: 8367.28$ 1 Bitcoin Cash ( # BCH ) Dollar: 1,231.11$ 1 Ethereum ( # ETH ) Dollar: 694.00$ 1 Ripple ( # XRP ) Dollar: 0.67389$ Date: 21 May 2018 22:22 # Bitcoin # Ethereum # cryptocurrency # crypto # altcoin # Blockchain # Ripple"
1980SteveH36,2018-05-21 21:55,4,7,"Here is why coinbase is a done deal just waiting to become official. https://youtu.be/_GkOl9FzGJ8 # xrp # ripple @ AlexCobb_ # btc @ Hodor7777 # xspring # xrapid # xrpcommunity @ coinbase"
deepak_joshi81,2018-05-21 21:50,1,12,"Thanks @ EugeneKesselman for the updates! # XRP wont disappoint you, I have been using it as a transfer of value for more than a year now (from one exchange/wallet to another) and seen the value transfer in just a few seconds! # xrpthestandard"
TapJets,2018-05-21 21:34,36,133,"Update from our CEO on # XRP @ Ripple efforts. Stay tuned and follow for more and upcoming announcements on the topic. https://twitter.com/EugeneKesselman/status/998678051033702400 …"
EugeneKesselman,2018-05-21 21:32,49,166,"Followup on our efforts: I had a call with @ miguelvias great guy and we are making progress. Contacted @ krakenfx # XRP exchange to see if they are able to assist. Things are looking good for # XRP with help of @ Ripple. Will continue to provide updates on our progress."
stephendpalley,2018-05-21 21:20,1,14,"Wait, so does Ripple claim they don't control XRP? Is that an argument?"
xrptips,2018-05-21 21:12,32,109,"# Ripple # XRP - 95+ percent traders are net long with long term positions - Accordingly to # realtime updates by @ DailyFX . Thank you, i think that matches with the # fundamentals & # sentiments overall given solid real world # usecases coming to # fruition. # 0doubt # XRPTheStandardhttps://twitter.com/DailyFXTeam/status/998666000190013442 …"
XRPHODLER,2018-05-21 21:10,61,169,"I would have preferred the # SBI Virtual Currency Exchange announcement... but this is nice | # Ripple # XRP http://www.businessinsider.com/lmax-exchange-launches-cryptocurrency-exchange-for-institutional-investors-2018-5 …"
XRPHODLER,2018-05-21 21:06,5,15,"# Ripple # XRP https://twitter.com/lmax/status/998483137603756033 …"
Akasost,2018-05-21 20:33,4,15,"The greatest redistribution of wealth modern economics has seen is about 2 happen. In fact it’s already begun with BTC $ T/Billions from the top 1% will redistribute to the bottom 99% via this new asset class. Most will miss out, don’t be one of them. # xrp # ripple # xrpcommunitypic.twitter.com/b84qGnIpCs"
cryptorecorder,2018-05-21 20:02,5,17,"$ TRON $ TRX $ XINFIN $ XDCE $ XRP Tron (TRX), XinFin (XDCE) & Ripple (XRP) technical analysis 21st – 22nd May – Market wide optimism driving up bullish sentiment @ Tronfoundation @ XinfinF @ Ripple # tron # trx # Xinfin # xdce # Ripple # XRP https://cryptorecorder.com/2018/05/21/tron-trx-xinfin-xdce-ripple-xrp-technical-analysis-21st-22nd-may-market-wide-optimism-driving-up-bullish-sentiment/ … via @ cryptorecorder"
DigitalAssetXRP,2018-05-21 19:50,20,57,"Interested in who these partners are that are using Ripple tech with some using $ xrp? Click on the link and scroll down. I love this list! # XRPTheStandard # xrpcommunity https://docs.google.com/spreadsheets/d/1E1AcLBd_ykemoDAPwZsbl5f2wyrS7RhlAt94CrHXTAg/htmlview#gid=1168577263 …pic.twitter.com/er07JgZ3qH"
misillad1,2018-05-21 19:37,11,31,"@ BankXRP Data443 - A validator on Ripple’s ledger with enterprise capabilities to safeguard consumer data. What a great pair! # blockchain # xrp # xrpthestandard # Ripple # Decentralization # DataPrivacy # GDPRready # GDPR # data443pic.twitter.com/fnUQCbs1BH"
NordicAnn,2018-05-21 19:33,15,61,"Finally! Thank you @ UpholdInc ! # XRPTheStandard # xrp # ripple # xrpcommunityhttps://twitter.com/upholdinc/status/998626326872379393 …"
Urfamat2,2018-05-21 18:59,8,8,"Güzel bir bedava # dogecoin sitesi 21.05.2018 bakiye resimde Sizde linkten kayıt olabilir mısınız siz # btc # bitcoin # crypto # cryptocurrency # ltc # litecoin # eth # ethereum # xrp # ripple # coinbase # bitcoinnews # cryptonews # btcusd # bitcoinpricepic.twitter.com/Dy3fCUO2wn"
habidave,2018-05-21 17:53,0,0,"BITCOIN STAR (10,000,000) AIRDROP (1,000,000 TOKENS REFERRAL) # airdrop # bounty # BTC # xrp # freetoken # Crypto # ETH # NEO # Blockchain # ripple # trx # tron # trx # binance # freetoken # airdrops # SCToken https://docs.google.com/forms/d/e/1FAIpQLSflJNrv1DKegq3Rd7PsUzohJD9qNGkjMood7GCg5NqbroyjZQ/viewform … Referrer ID: @Habidave1"
XRPonline,2018-05-21 17:44,2,6,"Ripple's Lösung für kleine und mittlere Banken @ XRPonline https://www.xrponline.de/ripple-loesung-banken-869/ … $ xrp # xrp # XRPcommunity # ripple # xrpthestandard # xrparmy # blockchain"
