username,date,retweets,favorites,text
emden_research,2018-05-13 09:31,0,1,"# crypto # iota # btc # ethereum # ripple # xrp (http://Emden-Reseach.com  – 11:28 Uhr) – Die Cyber-Devise Bitcoin hat es in der vergangenen Woche verpasst, die...https://www.emden-research.com/2018/05/13/bitcoin-ethereum-ripple-iota-wochenanalyse/ …"
NordicAnn,2018-05-13 09:11,9,205,"NYC here we come! Excited about # xrpcommunity night. If you see us, please come on over and say hello. We are very friendly. Looking forward to meeting y’all! # XRP @ Ripple # BlockchainWeekNYpic.twitter.com/eL5fOVNmEo"
C3_Nik,2018-05-13 08:06,26,165,"A shout-out to the team at @ Ripple which is working during the weekend to get version 1.0.0 released! Thank you! @ JoelKatz @ nbougalis # xrp # ripple # xrpthestandard # xrparmy # xrpcommunity"
coperu100,2018-05-13 07:13,240,521,"# リップル のパートナー # サンタンデール銀行 は1857年に設立され、4億人以上いるスペイン語圏最大の銀行。総資産190兆円、従業員20万人越えの世界トップ10に入る銀行。 https://coperu-100.com/kasotsuka/ripple/santander-xrp-appli/ … 凄さ・インパクトを簡単にまとめてみましたので、ご覧くださいm(_ _)m # ripple # xrp # こぺる100番台"
Dymacxrp,2018-05-13 02:11,5,109,"I really am embarrassed as a grown man that you would talk that way to anyone let alone a female. We get it. You don’t like XRP or Ripple. Blows my mind that you waste so much time and energy on something you do not like. Move on and find something else to do with your time."
haydentiff,2018-05-13 01:43,10,138,"If @ Ripple was really so AWFUL and @ bgarlinghouse was really so SCARY and @ arrington was really a LOSER, then people wouldn’t have to destroy their reputations unsuccessfully trying to prove it. F*** Ryan and have a beer with me. $ XRP # xrpthestandard"
cheerio_xrp,2018-05-13 01:40,21,58,"米AppleがRipple提唱のInterledger Protocol採用を示唆 https://crypto-times.jp/apple_ripple_interledger/ …"
BankXRP,2018-05-13 00:22,17,65,"Fast and Cheap: Ripple’s xRapid Delivers on its Promise https://globalcoinreport.com/fast-and-cheap-ripple-xrapid-delivers-on-its-promise/ … # xRapid # Ripple # XRP"
BankXRP,2018-05-12 23:52,31,64,"Craig DeWitt, Director of Product Management at Ripple at BlockTrain Global Blockchain 6 May, 2018. https://youtu.be/lFdnmWkArXM # XRP # Ripple @ XRPTrump"
BankXRP,2018-05-12 23:07,14,36,"Understand what needs to happen before Ripple can fully replace SWIFT https://philosophyofmetrics.com/peace-is-coming-to-this-world/ … # Ripple # XRP Worth a Follow >>> @ philosophyofmet"
bibiripple,2018-05-12 22:54,12,40,"インド最大の取引所ZebpayがRipple / XRP（リップル） &#8211; TRON / TRX（トロン）の通貨ペア取り扱い開始 https://coinonline.net/articles/10156"
HopperCrypto,2018-05-12 20:51,1,2,"# btc # bitcoin # ETH # ada # xlm # Ethereum $ XVG # LTC # Litecoin # XRP # Ripple # NEO # trx # tron # XVG # Vergecurrency # ICO # altcoin # tokens # crypto # cryptocurrency $ xlm # trading # ETN # BCN # XEM # DASH $ nano # HODL # hodling # Bitcointalk # altcoin # etc # onion $ DASH $ ltc $ xmr $ crypto $ pot"
rabia3497,2018-05-12 15:55,46,79,"$ SNM coin ile kazananlar. 22 saatte %14 Hiç fena değil. # Bitcoin # BTC $ BTC # Ethereum # ETH $ ETH # Litecoin # LTC $ LTC # Ripple # XRP $ XRP # BitcoinCash # BCH $ BCH # Verge # XVG $ XVG # EthereumClassic # ETC $ ETC # Qtum # QTUM $ QTUM # NEO # NEO $ NEO # Cardano # ADA $ ADA # TRON koin $ TRXpic.twitter.com/N1czZdl73T"
DigiByte_News,2018-05-12 14:40,50,97,"# Crypto will be the biggest # wealth transfer in history, from the impatient to patient. # Litecoin must go to $14,000 for 100x ROI (big # money already made in # LTC). # DigiByte must go to $4 for 100x ROI & # DGB to $13 would MATCH # Ripple's last marketcap run-up with 39 billion # XRP pic.twitter.com/Zl6MkdmFh2"
Vaughn_Tron,2018-05-12 14:36,15,50,"Another # TRON @ coinbase article. I just want to buy $ TRX direct with USD! # WeAreTron # tronics Reasons Why Coinbase Will Answer Tron (TRX) Ahead Of Ripple (XRP) https://www.cryptorecorder.com/2018/05/11/reasons-why-coinbase-will-answer-tron-trx-ahead-of-ripple-xrp/ …"
moweixuan,2018-05-12 14:26,0,0,"SWAPCHANGE（500 SC）AIRDROP令牌（250 SC TOKENS PER REFERRAL） # airdrop # bounty # BTC # xrp # freetoken # Crypto #ETH＃NEO6 # Blockchain # ripple # trx # tron # trx # binance # freetoken # airdrops # SCToken"
traderxrp,2018-05-12 14:19,13,40,"In the future, when something just a little bit boring becomes a wild success, it may be described as “pulling a Ripple.” # Ripple # xrpthestandard # xrp # xrparmy # xrpnews # cryptotwitter # cryptocurrencieshttps://cryptobriefing.com/why-ripple-laughs-in-the-face-of-unsexiness/ …"
cryptobeatz2017,2018-05-12 12:56,11,28,"『Ripple’s Use As A Coin, Will Be Key To XRP And Overall Crypto Adoption』 https://ethereumworldnews.com/ripples-use-as-a-coin-will-be-key-to-xrp-and-overall-crypto-adoption/ …"
usercaseAsset,2018-05-12 12:18,0,0,"@ soccerwatchtv hoffe bald mit fast payment Lösung @ Interledger @ Ripple # xrp # ripple # xrpthestandard # XRPCommunity"
RyanLibertyPawn,2018-05-12 11:41,45,151,"$ XRP is also drastically over-sold. Fill your bags here, now, # Ripple is on the way up with the rest of the market. Strong bounce expected. pic.twitter.com/2PfsO49V5b"
XRPDogg,2018-05-12 11:36,17,59,"Hold up, heyyy, to the people who be thinkin we soft, we don’t playyy, we gon’ rock it til the wheels fall off, hold up, heyyy, believe me @ Ripple ain’t actin too bold, take a seeat, hope you ready for the next episode heyyeyyEYEYyyEYYYY..... # XRP everyday. # Xrpcommunity # xrpside"
CryptoInvest18,2018-05-12 10:19,59,69,"So the markets are bouncing back big time today!!! Which of these are we buying?? Vote and Retweet! # crypto # cryptocurrency # bitcoin # btc # nem # xem # litecoin # ltc # zil # zilliqa # tron # trx # verge # xvg # ripple # xrp # stellar # monero # electra # eca # cardano # eos # altcoins # ethereum"
haydentiff,2018-05-12 08:47,137,556,"Look who I found on the # Consensus2018 list of speakers! It’s @ JoelKatz! Will anyone else from @ Ripple be speaking? $ XRP # xrpthestandardpic.twitter.com/vHbvoMXfsi"
Thirusmart7005,2018-05-12 07:58,0,0,"TRADE SIGNAL: http://bit.ly/2weyKaD $ BTC # Bitcoin $ ETH # Ethereum $ XRP # Ripple $ BCH # BitcoinCash $ LTC # Litecoin $ EOS # EOS $ ADA # Cardano $ XL"
cryptoriman,2018-05-12 07:44,451,227,"【XRPプレゼント2回目】 今回の暴落も一時的なものでしょう！夏に向けて仕込むには最高の相場です。 当たった方10人に、Ripple/XRPを50XRPづつ配布します。 結果はDMでお知らせいたします。 【参加条件】 フォロー&リツイート 【期限】 5月25日11:59 # XRP # Ripple"
DonChristiano73,2018-05-12 05:18,28,55,"Companies show ‘delighted’ response to Ripple [XRP]’s xRapid pilot https://ambcrypto.com/companies-delighted-response-ripple-xrp-xrapid-pilot/ … # XRP # xrpthestandard # ripple @ XRPtrump @ haydentiff @ BankXRP @ rjr13579 @ XRPstreetTEAM @ xrp_news @ RabbitKickClub @ Hodor7777 @ emy_wng @ clairearthurs # 0doubt @ lovebooalways"
DonChristiano73,2018-05-12 05:14,9,34,"Why Ripple (XRP) Is A Good Buy Under $0.70 https://cryptodaily.co.uk/2018/05/ripple-xrp-good-buy-0-70/ … # XRP # xrpthestandard # ripple @ XRPtrump @ haydentiff @ BankXRP @ rjr13579 @ XRPstreetTEAM @ xrp_news @ RabbitKickClub @ Hodor7777 @ emy_wng @ clairearthurs # 0doubt @ lovebooalways"
Yamamu1717,2018-05-12 04:01,12,45,"ripple社にとって最も重要な収益モデルの１つがXRPの普及です。そのため2015年に同社から発表されたインターレジャープロトコルはXRPに最適化されています。WebブラウザにこのAPIを導入させることによってXRPが使われやすいという状況を作っています # xrp # ripple https://ripple.com/blog/implementing-the-interledger-protocol/ …"
chewiecoin,2018-05-12 02:49,42,113,"Why isn’t XRP’s price going up? Here is my answer to that very commonly asked question. # xrp # Ripple # xrpthestandard https://www.xrpchat.com/topic/23453-why-isn …’t-xrp’s-price-going-up/"
eddie_GTR_xrp,2018-05-12 01:21,15,49,"SEC コミッショナー Hester M. Pierce 「イノベーションを繁栄させるための適切な規制措置を検討することに対し、私は積極的に支持します。」 要はSECとして、真っ当なイノベーションに対しては邪魔しないスタンスってことでしょー、リップルが望んでない形での規制はないと見ている。Go Ripple https://twitter.com/kieranmlkelly/status/995098669803335680 …"
BankXRP,2018-05-12 00:44,60,164,"# Ripple Rippled1.0.0+Debug. 1 Server Running for 3HR https://xrpcharts.ripple.com/#/topology # XRP @ XRPTrump @ AlexCobb_pic.twitter.com/Iqe7dAiSOt"
Hodor7777,2018-05-11 18:40,25,160,"Congrats on getting published by @ Forbes @ xrpsymbol - nice to see mainstream press giving credit for starting and championing this community effort at creating a new # xrp Unicode and character / symbol."
Ripple,2018-05-11 17:43,349,931,"Read @ xrpsymbol’s thoughtful piece in @ Forbes outlining specifically why he launched the movement to create a new symbol for # XRP. https://www.forbes.com/sites/forbesproductgroup/2018/05/11/xrp-not-ripple-the-quest-to-finding-the-xrp-symbol/#5f7d44525231 …"
WLFOFMYST,2018-05-11 16:00,28,69,"Reasons Why Coinbase Will Answer Tron (TRX) Ahead Of Ripple (XRP) $ trx # trx # tron # xrp https://www.cryptorecorder.com/2018/05/11/reasons-why-coinbase-will-answer-tron-trx-ahead-of-ripple-xrp/ …"
WietseWind,2018-05-11 15:59,6,24,"The transparency by @ Ripple is #1, but there is something else: because of the 20 XRP wallet reserve there are way less $ XRP wallets, so scanning, auditing and analyzing the existing wallets, transactions, amounts, etc. is easier."
C3_Nik,2018-05-11 15:39,7,43,"See both movements in price as a positive thing: When it goes down, it is an opportunity. When it goes up, it is a bounty for being patient. As long as you invest in the solid projects, you will be just fine. # NoFinancialAdvice # xrp # ripple # xrpthestandard"
mclynd,2018-05-11 15:30,7,9,"Ripple Announces Successful First Pilot Tests Using XRP. They reported the anticipated results of its xRapid pilot tests. Now, they claim that by using XRP, cross-border transactions can become cheaper and fasterhttp://bit.ly/2wD3Qsi # Ripple # XRP # Crypto # cryptocurrenci…pic.twitter.com/qNlWFOsM1Q"
BankXRP,2018-05-11 15:01,29,107,"Why Ripple Laughs In The Face Of Unsexiness https://cryptobriefing.com/why-ripple-laughs-in-the-face-of-unsexiness/ … # Ripple # XRP"
Ripplenews_tech,2018-05-11 14:48,25,84,"Ripple Reports Positive Results From xRapid Pilots https://ripplenews.tech/2018/05/11/ripple-reports-positive-results-xrapid-pilots/ … # xrapid # xrp # ripple"
RyanLibertyPawn,2018-05-11 14:42,27,92,"$ XRP hitting long-term support and bouncing nicely. All indicators turning bullish. I don't expect # Ripple to fall more/at all from here. Now is the time to add to bags, or take new positions since the BTC panic sell is done for now. # XRPcommunitypic.twitter.com/v03zsZJCjs"
BankXRP,2018-05-11 14:24,21,40,"Additional Bitcoin [BTC] and Ripple [XRP] trading pairs added by Indian exchanges to foil RBI circular https://ambcrypto.com/additional-bitcoin-btc-ripple-xrp-trading-pairs-added-indian-exchanges-foil-rbi-circular/ … # XRP # Ripple"
Hodor7777,2018-05-11 14:12,86,359,"`financial institutions using xRapid saw a savings of 40-70 percent compared to what they normally pay foreign exchange brokers.` Statistics like these keep adding consistent evidence for how use of # xrp saves money; Thanks for sharing @ ashgoblue and @ Ripple! # xrpcommunityhttps://twitter.com/ashgoblue/status/994563213789282304 …"
barrenrose,2018-05-11 13:05,0,1,"TRADE SIGNAL: http://bit.ly/2weyKaD $ BTC # Bitcoin $ ETH # Ethereum $ XRP # Ripple $ BCH # BitcoinCash $ LTC # Litecoin $ EOS # EOS $ ADA # Cardano $ XL"
kieranmlkelly,2018-05-11 12:03,5,140,"I think you’ll find that we hold XRP because of its use case. I also believe we are among the highest percentage of long term holders. Why the bee in your bonnet? You feel Laura and Ryan are getting more FUD and anti Ripple exposure, so you’re chiming in?"
XRPworld,2018-05-11 11:56,6,21,"Solving a real problem? - CHECK Coin has a REAL use? - CHECK Amazing team of intelligent and experienced people behind it? - CHECK Works with regulations instead of against it? - CHECK I sleep well at night knowing I hold XRP # XRP # Ripple # Crypto # bitcoin # ethereumhttps://twitter.com/stedas/status/994693166975668224 …"
XRPworld,2018-05-11 11:52,16,58,"We've seen only positive results about xRapid. XRP is one of the few coins with a REAL use case and is actually being used. This is only the beginning. Really excited about what the future is going to bring! # xrp # ripple # crypto # bitcoin"
stedas,2018-05-11 09:39,16,33,"“It’s encouraging to see positive xRapid (XRP) results because they validate what many in our industry already know: certain digital assets have utility...” Asheesh Birla, SVP of product @Ripple # xrp # xrpcommunity # ripple # xrpthestandard $ XRP # Ripple @ Ripple pic.twitter.com/ogBQuqkJlM"
DavidIusow,2018-05-11 08:40,0,1,"Boom, der Short der Woche :)) # Ripple # XRP # XRPcommunity # xrpsymbol # xrpusd $ xrpusd # criptovalute # Kryptowährungen @ SalahBouhmidihttps://twitter.com/SalahBouhmidi/status/994859054039257088 …"
SalahBouhmidi,2018-05-11 08:37,1,3,"# Ripple # Analyse: # Kursziel der Dreiecksformation erreicht http://bit.ly/2rAUGqx # XRP # xrpthestandard # XRPCommunity # xrpsymbol # XRPUSD $ XRPUSD # criptovalute # Kryptowaehrung # DailyFXpic.twitter.com/c6WLfeaUwk"
AndreasLipkow,2018-05-11 08:29,0,0,"Die Gewinnmitnahmen setzen sich bei den # Cryptos weiter fort. # BTC -6,3 %, # ETH -7,6 % und # XRP -13,5%. Je stabiler die etablierten # Finanzmärkte laufen, desto ruhiger ist es bei den # Cryptotoken. # bitcoin # ethereum # ripple pic.twitter.com/5VpeduhZXu"
XRPTrump,2018-05-11 05:47,5,30,"Tom, Worst part is that this discussion has been transparent for almost a year now. There is no reason for @ Multicoincap to repeatedly publish falsehoods and perpetuate misinformation when they've been corrected SEVERAL times by SEVERAL people about XRP! https://twitter.com/warpaul/status/946482697794240512 …"
lehoangnhutlinh,2018-05-11 05:39,1,0,"TRADE SIGNAL: http://bit.ly/2weyKaD $ BTC # Bitcoin $ ETH # Ethereum $ XRP # Ripple $ BCH # BitcoinCash $ LTC # Litecoin $ EOS # EOS $ ADA # Cardano $ XL"
XRPTrump,2018-05-11 04:20,16,112,"Sorry, for the purposes of discussion and XRP and xRapid, you guy are HIGHLY uneducated. Even after repeatedly being corrected about XRP being used as the bridge asset (Fiat1->XRP->FIAT2), you guys just keep repeating lies and misinformation. Have you no integrity?! RETRACT Now pic.twitter.com/TXv8qe93Js"
GoonAlerts_,2018-05-11 03:27,36,101,"Top 12 Coins ROI Check out the ROI these coins will give you if they run back to their highest points! URL: https://www.youtube.com/watch?v=LuhEL9-eIGw&t=1s … Tags: $ BTC $ ETH $ XRP $ BCC $ EOS $ NEO $ BCH $ LTC $ ADA $ XLM $ MIOTA $ TRX $ XMR $ GAS $ MIOTA # CRYPTO # Bitcoin # Ethereum # Ripple # BTC # ETH $ SUB $ SANpic.twitter.com/2T53fB73Xt"
Casper_XRP,2018-05-11 03:14,9,54,"このアメリカ→メキシコ間のパイロットは恐らくCuallix社のだと思いますが、今までも何度か「上手くいってる」「かなりコスト削減出来てる」とうのアナウンスがありました ここにきてRipple公式で結果報告という事は、ほぼ最終局面と言えるのではないでしょうか。 いよいよです。もう待ったなしです！"
SHND_JAPAN,2018-05-11 01:56,25,40,"http://CoinDeal.com にSHND/XRPのペアが追加されます！ 5月15日頃にSHND/BTCのペアが削除され、数日のうちにSHND/XRP のペアが追加される予定です！ これによってXRP保有者が SHND を直接トレードできるようになり、 すぐに SHMN にスワップすることができます。 # SHND # SHMN # XRP # ripple"
_83328_,2018-05-11 01:41,39,142,"ついにここまで来ましたね！ ここまでにripple社が開発にかけた金額はどのくらいでしょうか？ 多くはXRPの売却益であると思いますが、rippleのシステムを超えるシステムを開発しようとしたらそれだけの金が掛かるわけですよ。 ここまで進行したripple相手にそんな勝負を仕掛ける人はいるでしょうか？ https://twitter.com/crypto_narcist/status/994566541990445056 …"
aquresu,2018-05-11 01:40,46,162,"きゃー アップルペイで ゴールドマンと リップル 繋がっちゃうんじゃ ないかな いや 繋がる # ripple # XRP https://www.bloomberg.co.jp/news/articles/2018-05-10/P8IYJ46S972801 …"
TusharJain_,2018-05-11 01:26,14,117,"5/ It's in @ Ripple's interest to keep the debate as opaque & difficult to follow as possible. A debate with @ twobitidiot would clarify these mechanics & @ bgarlinghouse has no incentive to educate the market. The market's misconception of XRP is making him very wealthy. {fin}"
JFxhunter,2018-05-11 01:22,53,148,"The rippening starts to act as $ SHND/BTC replaced with $ SHND/$XRP # XRPCommunity @ coin_deal @ Ripple pic.twitter.com/89q0Tvafwx"
BankXRP,2018-05-11 00:11,81,160,"Viamerica piloted Ripple's xRapid Source https://www.businesswire.com/news/home/20180510005148/en/Ripple-Reports-Positive-Results-xRapid-Pilots … Viamerica URL : http://corporate.viamericas.com/ # Ripple # XRP pic.twitter.com/ewg06LzOF9"
XRPHODLER,2018-05-10 23:45,36,95,"# Ripple Cross-Border Payments Pilot: Financial Institutions Report Significant Time, Cost Savings | # XRP https://cointelegraph.com/news/ripple-cross-border-payments-pilot-financial-institutions-report-significant-time-cost-savings …"
toshina9379,2018-05-10 23:15,31,86,"只今ニュースでゴールドマンサックスとAppleがパートナーシップを結んだ。 XRPに追風吹けー # XRP # ripple"
ForbesCrypto,2018-05-10 22:45,46,127,"Blockchain firm Ripple revealed the results of two pilots using the XRP cryptocurrency to send international payments: http://on.forbes.com/6011DepCX  by @ DelRayManpic.twitter.com/4e4mhyPEZ4"
rabia3497,2018-05-10 22:02,50,81,"Bitcoin için en net yorum. Kırdığımı XXX ' i görür gibi 2 'li ihtimallerden uzak. Tebrik ederim. @ VipAltcoin # Bitcoin # BTC $ BTC # Ethereum # ETH $ ETH # Litecoin # LTC $ LTC # Ripple # XRP $ XRP # BitcoinCash # BCH $ BCH # Verge # XVG $ XVG $ TRX # TRON $ BLZ $ LUN $ SNM $ ZRX $ ZIL $ BAT coin $ VENpic.twitter.com/nXYAgVcZWJ"
stedas,2018-05-10 21:38,28,93,"`Real customers with real use cases: # xRapid pilots prove financial institutions can settle in minutes with up to 70% in savings. Results do speak louder than words...` Brad Garlinghouse, CEO at Ripple Read more here: http://bit.ly/2IbiGaX # XRP $ XRP # Ripple # XRPcommunitypic.twitter.com/vrBJEh8571"
cryptotraderxrp,2018-05-10 21:23,37,121,"Forbes wrote a great article on the XRP trials and how fast and efficient they are. Also they portrayed how these pilot tests are concrete evidence that XRP has very large applications pertaining to many aspects of daily life. # XRP # Ripple # 0doubthttps://www.forbes.com/sites/michaeldelcastillo/2018/05/10/ripple-reveals-results-of-first-pilots-using-xrp-cryptocurrency/amp/ …"
TheRealMarieBTC,2018-05-10 20:32,25,106,"Why I will never invest in Ripple $ XRP pic.twitter.com/Xg7Y0daE8j"
CarpeNoctom,2018-05-10 20:13,16,167,"`XRP is independent of Ripple` huh? lol https://twitter.com/Ripple/status/994669478452412416 …"
Ripple,2018-05-10 20:04,363,1290,"There is a community movement for a unique # XRP symbol. We agree! XRP is independent of Ripple. Submit your idea now. # XRPCommunity https://github.com/xrpsymbol/xrpsymbol.github.io/tree/master/suggestions-box …"
DelRayMan,2018-05-10 16:11,25,51,"Ripple Reveals Results Of First Pilots Using XRP Cryptocurrency: https://www.forbes.com/sites/michaeldelcastillo/2018/05/10/ripple-reveals-results-of-first-pilots-using-xrp-cryptocurrency/#99df686662d9 … by @ DelRayMan via @ ForbesCryptopic.twitter.com/Wis7noWXuF"
ForbesCrypto,2018-05-10 16:10,93,241,"Ripple Reveals Results Of First Pilots Using XRP Cryptocurrency: http://on.forbes.com/6014Dep4E  by @ DelRayManpic.twitter.com/uGpEAbg2E2"
DennisRossdale,2018-05-10 14:46,73,159,"“It’s clear that xRapid can lower liquidity costs while increasing payment speed and transparency in a way that facilitates rigorous compliance controls.” -Paul Dwyer, Cofounder and CEO of Viamericas http://corporate.viamericas.com # xrpthestandard # Ripple # XRP https://www.businesswire.com/news/home/20180510005148/en/Ripple-Reports-Positive-Results-xRapid-Pilots …"
eddie_GTR_xrp,2018-05-10 14:44,119,232,"RippleのパートナーであるマーキュリーFXからも嬉しいコメント。 「xRapidパイロットテストでの驚異的な速度とコスト効率化に感激しています」 「現時点でRippleとのコラボレーションは大成功で、近い将来の実稼働を楽しみにしています。」 創業者 Alastair Constance https://twitter.com/mercury_fx_ltd/status/994585661779972096 …"
mercury_fx_ltd,2018-05-10 14:31,424,856,"`Mercury is delighted with the incredible speed and cost-efficiency of the xRapid pilot phase and is excited about a production rollout in the near future,” said Founder Alastair Constance. “To date, the Ripple collaboration has been a great success.” # XRP https://www.businesswire.com/news/home/20180510005148/en/Ripple-Reports-Positive-Results-xRapid-Pilots …"
wsculley,2018-05-10 14:05,54,165,"This is a truly innovative method of moving value. Whether or not Ripple’s xRapid *product* becomes the standard, this *method* will be employed by every system that performs value-transfer or -exchange, and XRP will be an integral component. “The medium is the message” https://twitter.com/ashgoblue/status/994563213789282304 …"
umcrypto,2018-05-10 13:57,0,0,"10.05.2018 # AIRDROP # KRAUSY # Bitcoin $ Btc # Ethereum # Ripple $ Xrp $ Xlm $ Eos $ Neo $ Ltc $ Ada # Sprtz 260#KRAUS 1. Enter e-mail 2. Enter # eth address https://krausy.men/?candy=0ab822c30edef0b2f4e0390498e73b26 …"
miguelvias,2018-05-10 13:48,319,778,"For clarity, all xRapid transactions leveraged XRP, which is the primary reason for the speed and cost efficiency. With anything else acting as a bridge, these results would have been significantly worse. # xrpthestandard # 0doubt $ XRP # Ripple https://twitter.com/ashgoblue/status/994563213789282304 …"
mercury_fx_ltd,2018-05-10 13:44,170,393,"Here are some of our test results with # Ripple using # xRapid. Better, faster, cheaper. # XRP # XRPCommunityhttps://twitter.com/bgarlinghouse/status/994566225345724416 …"
madar0305,2018-05-10 13:40,1,0,"https://www.binance.com/?ref=10130882 # TRON $ ETH $ XVG $ STEEM $ GUP $ QTUM $ VOX $ ZEC $ DGB $ XLM $ XRP $ ADA $ SC $ BTC $ EDR $ IOTA $ TIO # ripple # xrparmy # ltc # xlm # airdrop # binance # bch # iota # storm # ada Bittrex / binance / BitMex calls best chatbox https://www.bitmex.com/register/0kdR2g https://t.me/bitMEXaltsCHATboxchatJOIN …"
AirdropUniverse,2018-05-10 13:39,0,1,"# Airdrop # Airdrops # airdrophunters # bounty # BountyProgram # BountyHunter # ICO # ICOs # Token # cryptocurrency # blockchain # bitcoin # ethereum # BTC # ETH # Stellar # Vergefam # Ripple # XLM # XVG # XRP @ Airdropalertcom $ iost $ arn $ wtc $ dgb $ kmd $ lsk $ SIA $ adabtc $ gvt $ hbz $ hsr $ LTCUSD $ hbzhttps://twitter.com/AirdropUniverse/status/994550668487733248 …"
bgarlinghouse,2018-05-10 13:34,533,1795,"Ryan, you demonstrate in this comment how little you understand about xRapid and Ripple's products. In fact EVERY xRapid transaction leveraged $ XRP. I don't mind well educated skeptics, but you continue to spread misinformation"
bakuagecoin,2018-05-10 13:30,92,233,"リップルがリリースした「Codius ベータ版」 ・現在のRippleより高速 ・セキュリティも一段と強化される ・相互の決済は一段と容易になる ・BTCやEHEに取って代わりうる ・実装は夏を目指している 隠しておいた実力の差が出始めるのは実需の年である今年だよね # XRP https://twitter.com/bitbit_ojin/status/994562299775012864 …"
twobitidiot,2018-05-10 13:25,18,130,"I believe the Ripple Inc tech is legit. But it’s important to note how little $ XRP is required to facilitate these transactions even under the rosiest scenarios. It’s not a reserve / bridge currency until some institutions actually buy and hold it at the market exchange rate. https://twitter.com/bgarlinghouse/status/994566225345724416 …"
eddie_GTR_xrp,2018-05-10 13:11,105,265,"RippleのXrapidのパイロットテストの結果が出たぞ！ 金融機関はxrapidで送金することで40%〜70%のコストカットに成功し、送金にかかった時間は2-3分。 いい感じ！そろそろ来るね！ https://twitter.com/ashgoblue/status/994563213789282304 …"
luca220114,2018-05-10 12:50,0,0,"Ich habe ein Video zu einer @ YouTube-Playlist hinzugefügt: http://youtu.be/JvcfYbA-9uw?a  Was ist Ripple? Was ist XRP? Und warum wird man"
zebpay,2018-05-10 11:30,271,676,"Zebpay is excited to announce the launch of XRP market for crypto-to-crypto trading. The first pair we're introducing is TRX/XRP. More crypto pairs coming soon. Happy Trading! # zebpaycryptotrading @ Ripple @ Tronfoundationpic.twitter.com/bWqIoCMx9o"
